{
    "$schema": "https://json-schema.org/draft/2020-12/schema",
    "$id": "https://nfh-trust-labs.github.io/vc-schemas/energy-credentials/electricity-credential/schema.json",
    "title": "Electricity Credential Schema",
    "description": "JSON Schema for a unified electricity credential that combines customer identity, customer details, consumption characteristics, generation capability, and storage capability as equal-level properties within a single W3C Verifiable Credential (VC Data Model 2.0). Issued by electricity distribution utilities.",
    "type": "object",
    "required": [
        "@context",
        "id",
        "type",
        "issuer",
        "validFrom",
        "credentialSubject"
    ],
    "properties": {
        "@context": {
            "type": "array",
            "items": {
                "type": "string"
            },
            "contains": {
                "const": "https://www.w3.org/ns/credentials/v2"
            },
            "minItems": 2
        },
        "id": {
            "type": "string",
            "format": "uri",
            "pattern": "^urn:uuid:[0-9a-f]{8}-[0-9a-f]{4}-[0-9a-f]{4}-[0-9a-f]{4}-[0-9a-f]{12}$",
            "description": "Unique identifier for the credential in URN UUID format"
        },
        "type": {
            "type": "array",
            "items": {
                "type": "string"
            },
            "contains": {
                "const": "ElectricityCredential"
            },
            "minItems": 2
        },
        "issuer": {
            "type": "object",
            "required": ["id", "name"],
            "properties": {
                "id": {
                    "type": "string",
                    "format": "uri",
                    "description": "URL of the issuing distribution utility"
                },
                "name": {
                    "type": "string",
                    "minLength": 1,
                    "description": "Name of the distribution utility"
                },
                "licenseNumber": {
                    "type": "string",
                    "minLength": 1,
                    "description": "Regulatory license number issued by the local energy regulator"
                }
            }
        },
        "validFrom": {
            "type": "string",
            "format": "date-time",
            "description": "Date and time from which the credential is valid (W3C VC Data Model 2.0)"
        },
        "validUntil": {
            "type": "string",
            "format": "date-time",
            "description": "Date and time until which the credential is valid (W3C VC Data Model 2.0)"
        },
        "credentialStatus": {
            "type": "object",
            "required": ["id", "type"],
            "description": "Revocation status information for the credential",
            "properties": {
                "id": {
                    "type": "string",
                    "format": "uri",
                    "description": "URL to query the revocation status of the credential via DeDi registry"
                },
                "type": {
                    "type": "string",
                    "const": "dediregistry",
                    "description": "Type of status check mechanism (DeDi Registry)"
                }
            }
        },
        "credentialSubject": {
            "type": "object",
            "description": "Single subject with five profile sections: customerProfile (required), customerDetails, consumptionProfile, generationProfile, storageProfile (all optional except customerProfile)",
            "required": ["customerProfile"],
            "properties": {
                "id": {
                    "type": "string",
                    "format": "uri",
                    "description": "Optional DID of the customer/credential subject"
                },
                "customerProfile": {
                    "$ref": "#/$defs/CustomerProfile"
                },
                "customerDetails": {
                    "$ref": "#/$defs/CustomerDetails"
                },
                "consumptionProfile": {
                    "$ref": "#/$defs/ConsumptionProfile"
                },
                "generationProfile": {
                    "$ref": "#/$defs/GenerationProfile"
                },
                "storageProfile": {
                    "$ref": "#/$defs/StorageProfile"
                }
            }
        },
        "proof": {
            "type": "object",
            "required": ["type", "created", "verificationMethod", "proofPurpose", "proofValue"],
            "properties": {
                "type": {
                    "type": "string",
                    "description": "Cryptographic signature type (e.g., Ed25519Signature2020)"
                },
                "created": {
                    "type": "string",
                    "format": "date-time",
                    "description": "Timestamp when the proof was created"
                },
                "verificationMethod": {
                    "type": "string",
                    "format": "uri",
                    "description": "URI of the verification method/public key"
                },
                "proofPurpose": {
                    "type": "string",
                    "enum": ["assertionMethod", "authentication"],
                    "description": "Purpose of the proof"
                },
                "proofValue": {
                    "type": "string",
                    "minLength": 1,
                    "description": "The cryptographic signature value"
                }
            }
        }
    },
    "$defs": {
        "CustomerProfile": {
            "type": "object",
            "description": "Core customer identity: customer number, meter number, masked ID",
            "required": ["customerNumber", "meterNumber", "meterType"],
            "properties": {
                "customerNumber": {
                    "type": "string",
                    "minLength": 1,
                    "description": "Full customer account number assigned by the utility"
                },
                "meterNumber": {
                    "type": "string",
                    "minLength": 1,
                    "maxLength": 50,
                    "description": "Unique meter serial number"
                },
                "meterType": {
                    "type": "string",
                    "enum": ["Smart", "Conventional", "Prepaid"],
                    "description": "Type of electricity meter installed"
                },
                "maskedIdType": {
                    "type": "string",
                    "minLength": 1,
                    "description": "Type of government-issued ID that has been masked (e.g., 'SSN', 'Passport', 'NationalID')"
                },
                "maskedIdNumber": {
                    "type": "string",
                    "minLength": 1,
                    "description": "Masked government ID for privacy-preserving verification (e.g., 'XXXX-XXXX-1234')"
                }
            }
        },
        "CustomerDetails": {
            "type": "object",
            "description": "Customer personal and address information",
            "required": ["fullName", "installationAddress", "serviceConnectionDate"],
            "properties": {
                "fullName": {
                    "type": "string",
                    "minLength": 1,
                    "maxLength": 200,
                    "description": "Full name of the customer as per ID proof"
                },
                "installationAddress": {
                    "type": "object",
                    "required": ["fullAddress", "postalCode", "country"],
                    "properties": {
                        "fullAddress": {
                            "type": "string",
                            "minLength": 1,
                            "maxLength": 500,
                            "description": "Complete street address of the installation"
                        },
                        "city": {
                            "type": "string",
                            "minLength": 1,
                            "description": "City name"
                        },
                        "district": {
                            "type": "string",
                            "minLength": 1,
                            "description": "District or county name"
                        },
                        "stateProvince": {
                            "type": "string",
                            "minLength": 1,
                            "description": "State, province, or region name"
                        },
                        "postalCode": {
                            "type": "string",
                            "minLength": 1,
                            "description": "Postal or ZIP code (format varies by country)"
                        },
                        "country": {
                            "type": "string",
                            "pattern": "^[A-Z]{2}$",
                            "description": "ISO 3166-1 alpha-2 country code"
                        }
                    }
                },
                "serviceConnectionDate": {
                    "type": "string",
                    "format": "date",
                    "description": "Date when the electricity connection was activated"
                }
            }
        },
        "ConsumptionProfile": {
            "type": "object",
            "description": "Connection and consumption characteristics for load management and tariff purposes",
            "required": ["premisesType", "connectionType", "sanctionedLoadKW", "tariffCategoryCode"],
            "properties": {
                "premisesType": {
                    "type": "string",
                    "enum": ["Residential", "Commercial", "Industrial", "Agricultural"],
                    "description": "Type of premises for the electricity connection"
                },
                "connectionType": {
                    "type": "string",
                    "enum": ["Single-phase", "Three-phase"],
                    "description": "Type of electrical connection"
                },
                "sanctionedLoadKW": {
                    "type": "number",
                    "minimum": 0.5,
                    "maximum": 10000,
                    "description": "Sanctioned/approved electrical load in kilowatts (kW)"
                },
                "tariffCategoryCode": {
                    "type": "string",
                    "minLength": 1,
                    "description": "Billing/tariff category code assigned by the utility"
                }
            }
        },
        "GenerationProfile": {
            "type": "object",
            "description": "DER (Distributed Energy Resource) generation capability",
            "required": ["generationType", "capacityKW", "commissioningDate"],
            "properties": {
                "assetId": {
                    "type": "string",
                    "minLength": 1,
                    "description": "Unique identifier for the generation asset"
                },
                "generationType": {
                    "type": "string",
                    "enum": ["Solar", "Wind", "MicroHydro", "Other"],
                    "description": "Type of distributed energy generation"
                },
                "capacityKW": {
                    "type": "number",
                    "minimum": 0.1,
                    "maximum": 10000,
                    "description": "Installed generation capacity in kilowatts (kW)"
                },
                "commissioningDate": {
                    "type": "string",
                    "format": "date",
                    "description": "Date when the generation system was activated"
                },
                "manufacturer": {
                    "type": "string",
                    "minLength": 1,
                    "maxLength": 200,
                    "description": "Equipment manufacturer"
                },
                "modelNumber": {
                    "type": "string",
                    "minLength": 1,
                    "maxLength": 100,
                    "description": "Equipment model number"
                }
            }
        },
        "StorageProfile": {
            "type": "object",
            "description": "Battery/energy storage capability",
            "required": ["storageCapacityKWh", "powerRatingKW", "commissioningDate"],
            "properties": {
                "assetId": {
                    "type": "string",
                    "minLength": 1,
                    "description": "Unique identifier for the storage asset"
                },
                "storageCapacityKWh": {
                    "type": "number",
                    "minimum": 0.1,
                    "maximum": 10000,
                    "description": "Battery storage capacity in kilowatt-hours (kWh)"
                },
                "powerRatingKW": {
                    "type": "number",
                    "minimum": 0.1,
                    "maximum": 10000,
                    "description": "Battery charge/discharge power rating in kilowatts (kW)"
                },
                "commissioningDate": {
                    "type": "string",
                    "format": "date",
                    "description": "Date when the storage system was activated"
                },
                "storageType": {
                    "type": "string",
                    "enum": ["LithiumIon", "LeadAcid", "FlowBattery", "Other"],
                    "description": "Type of battery storage technology"
                }
            }
        }
    }
}
