{
  "@context": [
    "https://www.w3.org/ns/credentials/v2",
    "https://schema.org/",
    "https://nfh-trust-labs.github.io/vc-schemas/energy-credentials/electricity-credential/context.jsonld"
  ],
  "id": "urn:uuid:e5f6a7b8-9012-34ab-cdef-567890123456",
  "type": ["VerifiableCredential", "ElectricityCredential"],
  "issuer": {
    "id": "https://example-utility.com/issuers/energy-dept",
    "name": "Example Energy Utility",
    "licenseNumber": "REG-2025-00001"
  },
  "validFrom": "2025-01-13T10:30:00Z",
  "validUntil": "2026-01-13T10:30:00Z",
  "credentialStatus": {
    "id": "https://dedi.global/dedi/query/example-utility.com/vc-revocation-registry",
    "type": "dediregistry"
  },
  "credentialSubject": {
    "id": "did:example:customer:abc123",
    "customerProfile": {
      "customerNumber": "UTIL-2025-001234567",
      "meterNumber": "MET2025789456123",
      "meterType": "Smart",
      "maskedIdType": "SSN",
      "maskedIdNumber": "XXXX-XXXX-1234"
    },
    "customerDetails": {
      "fullName": "Jane Doe",
      "installationAddress": {
        "fullAddress": "123 Energy Street, Unit 4",
        "city": "Metro City",
        "district": "Metro District",
        "stateProvince": "Example State",
        "postalCode": "12345",
        "country": "US"
      },
      "serviceConnectionDate": "2025-01-10"
    },
    "consumptionProfile": {
      "premisesType": "Residential",
      "connectionType": "Single-phase",
      "sanctionedLoadKW": 5,
      "tariffCategoryCode": "RES-01"
    },
    "generationProfile": {
      "assetId": "DER-SOLAR-001",
      "generationType": "Solar",
      "capacityKW": 3,
      "commissioningDate": "2025-01-12",
      "manufacturer": "SunPower Corporation",
      "modelNumber": "SPR-X22-360"
    },
    "storageProfile": {
      "assetId": "BESS-001",
      "storageCapacityKWh": 10,
      "powerRatingKW": 5,
      "commissioningDate": "2025-01-12",
      "storageType": "LithiumIon"
    }
  },
  "proof": {
    "type": "Ed25519Signature2020",
    "created": "2025-01-13T10:30:00Z",
    "verificationMethod": "https://example-utility.com/issuers/energy-dept#key-1",
    "proofPurpose": "assertionMethod",
    "proofValue": "z58DAdFfa9SkqZMVPxAQpic7ndTaXoT..."
  }
}
