{
  "@context": [
    "https://www.w3.org/ns/credentials/v2",
    "https://schema.org/",
    "https://schema.beckn.io/meter-data-vc/context.jsonld"
  ],
  "id": "urn:uuid:a1b2c3d4-5678-90ab-cdef-1234567890ab",
  "type": ["VerifiableCredential", "MeterDataCredential"],
  "issuer": {
    "id": "did:web:example-utility.com",
    "name": "Example Energy Utility",
    "licenseNumber": "REG-2025-00001"
  },
  "validFrom": "2025-07-15T06:00:00Z",
  "credentialStatus": {
    "id": "https://dedi.global/dedi/query/did:web:example-utility.com/VC_revocation_registry",
    "type": "dediregistry"
  },
  "credentialSubject": {
    "id": "did:example:consumer:abc123",
    "customerProfile": {
      "customerNumber": "UTIL-2025-001234567",
      "meterNumber": "MET2025789456123",
      "meterType": "Smart"
    },
    "meterData": {
      "serviceKind": "electricity",
      "timeZone": "Asia/Kolkata",
      "readingType": {
        "commodity": "electricitySecondaryMetered",
        "flowDirection": "forward",
        "uom": "kWh",
        "accumulationBehaviour": "deltaData",
        "intervalLength": 900,
        "currency": "INR",
        "measurementKind": "energy"
      },
      "qualityOfReading": "validated",
      "coveragePeriod": {
        "start": "2025-07-14T18:30:00Z",
        "end": "2025-07-14T19:30:00Z"
      },
      "intervalBlocks": [
        {
          "interval": {
            "start": "2025-07-14T18:30:00Z",
            "duration": 3600
          },
          "intervalReadings": [
            {
              "timePeriod": {
                "start": "2025-07-14T18:30:00Z",
                "duration": 900
              },
              "value": 0.375,
              "cost": 2.813
            },
            {
              "timePeriod": {
                "start": "2025-07-14T18:45:00Z",
                "duration": 900
              },
              "value": 0.41,
              "cost": 3.075
            },
            {
              "timePeriod": {
                "start": "2025-07-14T19:00:00Z",
                "duration": 900
              },
              "value": 0.52,
              "cost": 5.2
            },
            {
              "timePeriod": {
                "start": "2025-07-14T19:15:00Z",
                "duration": 900
              },
              "value": 0.485,
              "cost": 4.85,
              "readingQuality": "estimatedUsingLinearInterpolation"
            }
          ]
        }
      ]
    }
  },
  "proof": {
    "type": "Ed25519Signature2020",
    "created": "2025-07-15T06:00:00Z",
    "verificationMethod": "did:web:example-utility.com#key-1",
    "proofPurpose": "assertionMethod",
    "proofValue": "z58DAdFfa9SkqZMVPxAQpic7ndTaXoT..."
  }
}
